{"version":"1.0.0","engine":{"renderer":"Unreal Engine 5","geometry":"Nanite","lighting":"Lumen","textures":"8K","toneMapping":"ACES"},"rendering":{"shading":"PBR","antiAliasing":"TSR"},"materials":[{"name":"M_Metal_Brushed","degradedStrainedParameter":"DegradedStrained"},{"name":"M_Glass_Smart","degradedStrainedParameter":"DegradedStrained"},{"name":"M_Concrete_Sovereign","degradedStrainedParameter":"DegradedStrained"},{"name":"M_Emissive_Circuit","degradedStrainedParameter":"DegradedStrained"},{"name":"M_Holo_Panel","degradedStrainedParameter":"DegradedStrained"},{"name":"M_Data_Flow","degradedStrainedParameter":"DegradedStrained"},{"name":"M_Shield_TLS","degradedStrainedParameter":"DegradedStrained"},{"name":"M_Energy_Conduit","degradedStrainedParameter":"DegradedStrained"}],"ui":{"style":"photorealistic holographic","primitives":["Panel","Header","Button","Badge","Progress","Metric","Divider","DataFlow","StatusIndicator"]},"assetCompliance":{"blocking":true,"requiredMaterialParameter":"DegradedStrained"}}